{
 "name": "onboarded-brand",
 "note": "Test fixture: a neutral brand with all four references approved.",
 "palette": {"ink": "#1b1b1b", "paper": "#ffffff"},
 "voice": {"provider": "elevenlabs", "voice_id": "fixture-voice-0002", "model": "eleven_v4", "settings": {"stability": 0.4}},
 "truth": {"approved_claims": [{"text": "Plans take ten minutes to set up."}, {"text": "Works offline."}], "banned_words": []},
 "references": {
  "truth": {"file": "refs/truth.md", "sha256": "0000000000000000000000000000000000000000000000000000000000000001", "approved_by": "Test Person", "approved_at": "2026-09-30"},
  "look_motion": {"file": "refs/look.mp4", "sha256": "0000000000000000000000000000000000000000000000000000000000000002", "approved_by": "Test Person", "approved_at": "2026-09-30"},
  "voice": {"file": "refs/voice.wav", "sha256": "0000000000000000000000000000000000000000000000000000000000000003", "approved_by": "Test Person", "approved_at": "2026-09-30"},
  "sound": {"file": "refs/sound.wav", "sha256": "0000000000000000000000000000000000000000000000000000000000000004", "approved_by": "Test Person", "approved_at": "2026-09-30"}
 }
}
